{
  "version": 1,
  "enabled": true,
  "excludedTags": ["demo-no-promo", "demo-clearance"],
  "markets": [
    {
      "marketId": "gid://shopify/Market/900001",
      "currencyCode": "EUR",
      "tiers": [
        { "minimumSubtotal": "100.00", "percentage": 10 },
        { "minimumSubtotal": "200.00", "percentage": 15 }
      ]
    },
    {
      "marketId": "gid://shopify/Market/900002",
      "currencyCode": "USD",
      "tiers": [{ "minimumSubtotal": "150.00", "percentage": 12 }]
    }
  ]
}
